{
  "schema_version": "ushso.ai-conflict-analysis-request.v1",
  "request_id": "conflict-request:scale-service-line-count:2026-07-18",
  "review_tier": "ordinary_material_claim",
  "reviews": [
    {
      "schema_version": "ushso.strategic-review.v1",
      "review_id": "review:74bdf7b423d88ac031b15b1d11b86e1b",
      "request_id": "review-request:scale-service-line-count:methods:2026-07-18",
      "review_tier": "ordinary_material_claim",
      "protocol": {
        "protocol_id": "cso.evidence-methods-measurement.v1",
        "version": "1.0.0",
        "protocol_hash": "sha256:37f245f9fadffda8e2faaeb67612eb3280859ae2e8f84b74e68df9a1dcfbbb72",
        "registry_hash": "sha256:383bbb58defe5cb5dd80382a01c68782052d9f44b4bc383f5c1ba4aa748dd12a",
        "competence_role": "evidence_methods_measurement_biostatistics"
      },
      "reviewer": {
        "reviewer_id": "scale-service-line-count:methods:1",
        "agent_slug": "healthit-clinical-data-analyst",
        "prompt_version": "2026-07-18",
        "repo_commit": "0bf8fb60c789a441363389f1cd39a0868da5eb34",
        "model": "gpt-5.6-sol",
        "runtime": "codex-desktop-2026-07-18",
        "independence": {
          "prior_exposure": "none",
          "conflict_disclosures": [],
          "direct_material_conflict": false,
          "attestation": true
        }
      },
      "review_request_hash": "sha256:6605d1e88eecffcdd5bb6f036e4666a7cbb7e85dacd530659c7ad37072a21492",
      "review_context_hash": "sha256:d25570eaebe718a6dc7ec0695e5f4f0d94dfc8086341520d548f8efbb3d43cfe",
      "input_hashes": [
        "sha256:dfda9c60da75e2cb241c050965ec2cbeff9e3ebb305543ae859f4458345c81f9",
        "sha256:bc6899e07dfd3f8f5daaf411c2782cbded0893ff8e0550d243bba4e5d0f3550a",
        "sha256:bb41a834d64c52ae65beef077292b6986ff9754bf81441464150b0ea976b30f6",
        "sha256:9ccc4c894ce9e465bd943255abe424f8a777f8b93e1e59e08f6c24ebec72d34a",
        "sha256:252e15a3bd08dcf95b06885b78743113049bbada1134f44e93daa55d0a956d38"
      ],
      "frozen_inputs": {
        "evidence_bundle_ref": "ushso-rebuild://scale-inputs/service-line-count/public-evidence-bundle",
        "evidence_bundle_hash": "sha256:dfda9c60da75e2cb241c050965ec2cbeff9e3ebb305543ae859f4458345c81f9",
        "identity_binding_ref": "git:d57b1883044475f9dac87eae1ac6806fda1d9728:contracts/reusable-run/v3/fixtures/service-line-count/identity-binding.json",
        "identity_binding_hash": "sha256:bc6899e07dfd3f8f5daaf411c2782cbded0893ff8e0550d243bba4e5d0f3550a",
        "computations": [
          {
            "ref": "git:d57b1883044475f9dac87eae1ac6806fda1d9728:contracts/reusable-run/v3/fixtures/service-line-count/cumulative-packet.json",
            "hash": "sha256:bb41a834d64c52ae65beef077292b6986ff9754bf81441464150b0ea976b30f6"
          },
          {
            "ref": "git:d57b1883044475f9dac87eae1ac6806fda1d9728:contracts/reusable-run/v3/fixtures/service-line-count/no-execution-result.json",
            "hash": "sha256:9ccc4c894ce9e465bd943255abe424f8a777f8b93e1e59e08f6c24ebec72d34a"
          }
        ],
        "claim_candidates": [
          {
            "claim_id": "claim:scale-v1:service-line-count-cycle:no-execution:2026-07-18",
            "claim_hash": "sha256:252e15a3bd08dcf95b06885b78743113049bbada1134f44e93daa55d0a956d38",
            "evidence_refs": [
              "claim:scale-v1:service-line-count-cycle:no-execution:2026-07-18",
              "cms-hcris:210032:number-of-beds",
              "cms-pos:210032:bed_cnt",
              "cms-pos:390027:bed_cnt",
              "computation:scale-v1:all-six:no-score:2026-07-16",
              "conflict:chestnut-hill-ownership-and-bases",
              "conflict:christianacare-shared-cms-reporting-entity",
              "conflict:christianacare:annual-discharges:comparability",
              "conflict:christianacare:operating_revenue_usd:comparability",
              "conflict:christianacare:physician-count:comparability",
              "conflict:christianacare:service-line-count:taxonomy-boundary",
              "conflict:cooper-childrens-separate-hospital",
              "conflict:cooper-university-health-care:annual-discharges:comparability",
              "conflict:cooper-university-health-care:operating_revenue_usd:comparability",
              "conflict:cooper-university-health-care:physician-count:comparability",
              "conflict:cooper-university-health-care:service-line-count:taxonomy-boundary",
              "conflict:jefferson-health:annual-discharges:comparability",
              "conflict:jefferson-health:operating_revenue_usd:comparability",
              "conflict:jefferson-health:physician-count:comparability",
              "conflict:jefferson-health:service-line-count:taxonomy-boundary",
              "conflict:main-line-health:annual-discharges:comparability",
              "conflict:main-line-health:operating_revenue_usd:comparability",
              "conflict:main-line-health:physician-count:comparability",
              "conflict:main-line-health:service-line-count:taxonomy-boundary",
              "conflict:penn-medicine:annual-discharges:comparability",
              "conflict:penn-medicine:operating_revenue_usd:comparability",
              "conflict:penn-medicine:physician-count:comparability",
              "conflict:penn-medicine:service-line-count:taxonomy-boundary",
              "conflict:temple-health:annual-discharges:comparability",
              "conflict:temple-health:operating_revenue_usd:comparability",
              "conflict:temple-health:physician-count:comparability",
              "conflict:temple-health:service-line-count:taxonomy-boundary",
              "conflict:temple-shared-cms-reporting-entity",
              "conflict:union-bed-bases",
              "coverage:bed-missing:cooper-university-health-care:childrens-regional",
              "coverage:bed-missing:jefferson-health:rothman-orthopaedic-specialty-hospital",
              "coverage:bed-missing:penn-medicine:hup-cedar",
              "identity-binding:scale-v1:all-six-roster-bed:2026-07-16",
              "md-bed:union:licensed-fy2026",
              "receipt:all-six:service-line-count:cms-rbcs-taxonomy",
              "receipt:christianacare:service-line-count:ahrq-identity",
              "receipt:cooper-university-health-care:service-line-count:ahrq-identity",
              "receipt:jefferson-health:service-line-count:ahrq-identity",
              "receipt:main-line-health:service-line-count:ahrq-identity",
              "receipt:penn-medicine:service-line-count:ahrq-identity",
              "receipt:temple-health:service-line-count:ahrq-identity",
              "roster:penn-medicine:hup-cedar",
              "roster:temple-health:chestnut-hill",
              "scale-input-binding:service-line-count:all-six:2026-07-18",
              "scale-input-packet:all-six:service-line-count-cycle:2026-07-18",
              "scale-no-execution:service-line-count:2026-07-18",
              "scenario:scale-v1:all-six-roster-bed-readiness:2026-07-16",
              "scenario:scale-v1:service-line-count-fitness:2026-07-18",
              "state-bed:pa-hospital-report-2024-1a:temple-university-hospital:beds-set-up-and-staffed",
              "state-bed:pa-hospital-report-2024-1a:temple-university-hospital:licensed-beds"
            ]
          }
        ]
      },
      "frozen_inputs_hash": "sha256:b9793a24be34a1044ab0fc6449276dfe27aa4c1fa265bda797c702f8cbe926a8",
      "evidence_bundle_ref": "ushso-rebuild://scale-inputs/service-line-count/public-evidence-bundle",
      "identity_binding_ref": "git:d57b1883044475f9dac87eae1ac6806fda1d9728:contracts/reusable-run/v3/fixtures/service-line-count/identity-binding.json",
      "decision_scenario": {
        "ref": "git:d57b1883044475f9dac87eae1ac6806fda1d9728:contracts/reusable-run/v3/fixtures/service-line-count/decision-scenario.json",
        "hash": "sha256:44746e8e0e85ff20df08cc338487fdaf8e79c660492553f95344e3eb1ea9f8fa"
      },
      "decision_scenario_ref": "git:d57b1883044475f9dac87eae1ac6806fda1d9728:contracts/reusable-run/v3/fixtures/service-line-count/decision-scenario.json",
      "evidence_boundary": "Frozen temporary-only service-line-count packet. All 54 cells remain 0 populated, 30 blocked_source_conflict, 6 unavailable_public, and 18 not_yet_researched. Six service-line taxonomy conflicts plus 23 prior conflicts make 29 cumulative open conflicts. AHRQ provides identity but no service-line field; CMS RBCS classifies paid Medicare Part B HCPCS activity rather than offered services, and embedded CPT/HCPCS redistribution rights remain unknown_review_required. All ten comparability gates remain unresolved. The protocol registry has no service-taxonomy competence lane; the second reviewer is limited to portfolio, rights, transaction, and governance constraints and conveys no taxonomy authority. No averaging, automatic adjudication, human authority, profile population, calculation, sensitivity, projection, recommendation, promotion, or deployment is authorized.",
      "first_assessment_hash": "sha256:a7558e1fc75af434e436fdecfe8ce3d91a05f9f5f9b23baa83f7a31f1dae7744",
      "exposure_status": "independent_first",
      "evidence_mutated": false,
      "posture_assessments": [
        {
          "posture": "acquire",
          "effect": "unresolved",
          "claim_refs": [
            "claim:scale-v1:service-line-count-cycle:no-execution:2026-07-18"
          ],
          "evidence_refs": [
            "scale-input-packet:all-six:service-line-count-cycle:2026-07-18",
            "conflict:christianacare:service-line-count:taxonomy-boundary"
          ],
          "rationale": "The unavailable acquire evidence state establishes only that Scale execution is ineligible.",
          "limitation": "No comparable offered-service taxonomy, system count, rights clearance, or taxonomy-competent human review exists. No posture is recommended."
        },
        {